doc_type	doc_id	num	date_str	description	url_metadata	lang	url_pdf
lk_treasury_press_releases	2025-07-30-2025-07-30-d1aea6	2025-07-30-d1aea6	2025-07-30	Investor Call in Relation to Macro-Linked and Governance-Linked Bonds	https://www.treasury.gov.lk//web/press-releases/section/2025	en	https://www.treasury.gov.lk//api/file/bf543476-9d80-4115-8f1f-4b1eb0a8526c
lk_treasury_press_releases	2025-07-14-2025-07-14-8adac6	2025-07-14-8adac6	2025-07-14	Signing of Bilateral Amendatory Loan Agreements between GoSL and the Saudi Fund for Development (SFD) under the External Debt Restructuring Process of Sri Lanka.	https://www.treasury.gov.lk//web/press-releases/section/2025	en	https://www.treasury.gov.lk//api/file/5d4c0a07-ea6a-4290-8480-2ec16e661aeb
lk_treasury_press_releases	2025-07-11-2025-07-11-b42c9e	2025-07-11-b42c9e	2025-07-11	Sri Lanka Recorded One of the Most Significant Score Improvements in Investor Relations Practices in 2025	https://www.treasury.gov.lk//web/press-releases/section/2025	en	https://www.treasury.gov.lk//api/file/3e0fb22a-9c99-4b2a-948f-bab9c686bafb
lk_treasury_press_releases	2025-07-01-2025-07-01-30540c	2025-07-01-30540c	2025-07-01	Signing of Agreement on Debt Restructuring between Hungary and the Government of Sri Lanka in relation to External Debt Restructuring Process	https://www.treasury.gov.lk//web/press-releases/section/2025	en	https://www.treasury.gov.lk//api/file/3a6d9721-7b77-4ba4-9ab5-eedd213b5cd3
lk_treasury_press_releases	2025-07-01-2025-07-01-243920	2025-07-01-243920	2025-07-01	හංගේරියාව සහ ශ්‍රී ලංකා රජය අතර විදේශ ණය ප්‍රතිව්‍යුහගත කිරීමේ ක්‍රියාවලියට අදාළ ණය ප්‍රතිව්‍යුහගත කිරීම පිළිබඳ ගිවිසුම අත්සන් කිරීම	https://www.treasury.gov.lk//web/press-releases/section/2025	si	https://www.treasury.gov.lk//api/file/d0b650a3-8eb8-4e50-b466-3c05f4c5bc19
lk_treasury_press_releases	2025-05-15-2025-05-15-13de25	2025-05-15-13de25	2025-05-15	Signing of Bilateral Amendatory Agreements between GoSL and the Export - Import Bank (EXIM) of India pertaining to the Line of Credits and Buyer’s Credit Loan Agreements under the External Debt Restructuring Process of Sri Lanka.	https://www.treasury.gov.lk//web/press-releases/section/2025	en	https://www.treasury.gov.lk//api/file/a0c1815f-8bfc-419a-a3f5-c308895d95ba
lk_treasury_press_releases	2025-04-08-2025-04-08-bac3d7	2025-04-08-bac3d7	2025-04-08	Government Strengthens Efforts to Revitalize Small and Medium Enterprises (SMEs)	https://www.treasury.gov.lk//web/press-releases/section/2025	en	https://www.treasury.gov.lk//api/file/a2825897-d5a3-4b6a-b41e-30fe3b9f82f1
lk_treasury_press_releases	2025-04-04-2025-04-04-31ebef	2025-04-04-31ebef	2025-04-04	Sri Lanka Ready to Engage with the United States in Strengthening Trade Relations	https://www.treasury.gov.lk//web/press-releases/section/2025	en	https://www.treasury.gov.lk//api/file/940601f4-f779-4566-a03f-f360e39a1290
lk_treasury_press_releases	2025-02-10-2025-02-10-ca2f29	2025-02-10-ca2f29	2025-02-10	රාජ්‍ය ආයෝජන අධීක්ෂණ හා ඇගයීම් කමිටුව පිහිටුවීම	https://www.treasury.gov.lk//web/press-releases/section/2025	si	https://www.treasury.gov.lk//api/file/6993af42-9ebc-4c85-9511-b995ebf7f273
lk_treasury_press_releases	2025-01-31-2025-01-31-b0d84d	2025-01-31-b0d84d	2025-01-31	Removal of Temporary Suspention on Importation of Motor Vehicles Stage III	https://www.treasury.gov.lk//web/press-releases/section/2025	en	https://www.treasury.gov.lk//api/file/50b67cfa-3c11-4078-802d-a9d7d1c9b333
lk_treasury_press_releases	2025-01-31-2025-01-31-31a097	2025-01-31-31a097	2025-01-31	Issuance of New Regulation and Order by the Minister of Finance, Planning and Economic Development	https://www.treasury.gov.lk//web/press-releases/section/2025	en	https://www.treasury.gov.lk//api/file/afd1361e-74f3-4dc2-8da5-7f7545467052
lk_treasury_press_releases	2025-01-11-2025-01-11-70181d	2025-01-11-70181d	2025-01-11	Revision of Excise Duty under Excise (Special Provisions) Act, No. 13 of 1989	https://www.treasury.gov.lk//web/press-releases/section/2025	en	https://www.treasury.gov.lk//api/file/bd3eb521-65e6-4483-ab90-865f24f1641f
lk_treasury_press_releases	2025-01-09-2025-01-09-1376d0	2025-01-09-1376d0	2025-01-09	A Concessionary Pledge Loan Scheme for Small and Medium Scale Paddy Millers and Cooperative Societies from 3rd January 2025 to purchase Paddy for Maha Season 2024/2025	https://www.treasury.gov.lk//web/press-releases/section/2025	en	https://www.treasury.gov.lk//api/file/376f0ade-0c69-43c6-9047-030ea7bda24a
lk_treasury_press_releases	2024-12-18-2024-12-18-fa680e	2024-12-18-fa680e	2024-12-18	Removal of Temporary Suspension on Importation of Motor Vehicles – Stage I	https://www.treasury.gov.lk//web/press-releases/section/2024	en	https://www.treasury.gov.lk//api/file/413ccb47-960c-409f-b770-35ded724a309
lk_treasury_press_releases	2024-12-18-2024-12-18-eb8210	2024-12-18-eb8210	2024-12-18	Establishment of the Public Debt Management Office	https://www.treasury.gov.lk//web/press-releases/section/2024	en	https://www.treasury.gov.lk//api/file/1f4a438a-98b1-45df-80a0-3d91c0e33459
lk_treasury_press_releases	2024-12-18-2024-12-18-044443	2024-12-18-044443	2024-12-18	Sri Lanka Announces Final Results of the Invitation to Exchange in Respect of its International Sovereign Bonds	https://www.treasury.gov.lk//web/press-releases/section/2024	en	https://www.treasury.gov.lk//api/file/8717eef6-89f9-4903-bcb3-3787bde1c90f
lk_treasury_press_releases	2024-12-13-2024-12-13-79532f	2024-12-13-79532f	2024-12-13	SRI LANKA ANNOUNCES THE SUCCESSFUL EXPIRATION OF ITS CONSENT SOLICITATION AND EXCHANGE OFFER RELATED TO ITS INTERNATIONAL SOVEREIGN BONDS	https://www.treasury.gov.lk//web/press-releases/section/2024	en	https://www.treasury.gov.lk//api/file/a96d4a52-a637-408c-9fd0-5a726ea5b526
lk_treasury_press_releases	2024-12-05-2024-12-05-a356d0	2024-12-05-a356d0	2024-12-05	Supplementary Estimates-2024	https://www.treasury.gov.lk//web/press-releases/section/2024	en	https://www.treasury.gov.lk//api/file/e5013dd3-5713-457e-8d05-bc605dc02c02
lk_treasury_press_releases	2024-12-05-2024-12-05-540da2	2024-12-05-540da2	2024-12-05	Vote on Account-2025	https://www.treasury.gov.lk//web/press-releases/section/2024	en	https://www.treasury.gov.lk//api/file/a082bf27-b91b-4851-9a86-c5ac1f26bea1
lk_treasury_press_releases	2024-11-30-2024-11-30-71421a	2024-11-30-71421a	2024-11-30	අර්තාපල් හා ලොකු ළූණු සදහා වන බදු සංශෝධන	https://www.treasury.gov.lk//web/press-releases/section/2024	si	https://www.treasury.gov.lk//api/file/35f9948d-c690-4a33-9480-c02bf3b24c8c
lk_treasury_press_releases	2024-11-26-2024-11-26-0360f5	2024-11-26-0360f5	2024-11-26	Sri Lanka Announces the Launch of International Sovereign Bonds Exchange Following Cabinet of Ministers Approval	https://www.treasury.gov.lk//web/press-releases/section/2024	en	https://www.treasury.gov.lk//api/file/fec13de3-8b7f-40a5-878a-d73dfbfd752a
lk_treasury_press_releases	2024-11-09-2024-11-09-80fece	2024-11-09-80fece	2024-11-09	සීමාසහිත ශ්‍රී ලංකා ත්‍රිපෝෂ සමාගම සම්බන්ධයෙන් නව රජයේ ස්ථාවරය	https://www.treasury.gov.lk//web/press-releases/section/2024	si	https://www.treasury.gov.lk//api/file/93e3bc91-a843-4b3f-9a4f-d301774ef83a
lk_treasury_press_releases	2024-10-18-2024-10-18-4d818c	2024-10-18-4d818c	2024-10-18	රජය විසින් භාණ්ඩ වර්ග 05 ක් සදහා අළුතින්  විශේෂ වෙළඳ භාණ්ඩ බදු පනවා ඇති බවට සිදුකරන අසත්‍ය මාධ්‍ය ප්‍රචාරණයන් පිලිබඳවයි	https://www.treasury.gov.lk//web/press-releases/section/2024	si	https://www.treasury.gov.lk//api/file/53e12ad5-d5ef-4d36-b875-6c8706d4260c
lk_treasury_press_releases	2024-10-04-2024-10-04-e97e2a	2024-10-04-e97e2a	2024-10-04	Sri Lanka announces successful completion of the OCC and IMF consultation process	https://www.treasury.gov.lk//web/press-releases/section/2024	en	https://www.treasury.gov.lk//api/file/41209cc3-2384-421e-9404-d1843bf2176e
lk_treasury_press_releases	2024-10-04-2024-10-04-9b5f8d	2024-10-04-9b5f8d	2024-10-04	Sri Lanka’s International Sovereign Bonds Restructuring – Frequently Asked Questions	https://www.treasury.gov.lk//web/press-releases/section/2024	en	https://www.treasury.gov.lk//api/file/19600b87-2a77-45a2-b317-2a110e1bf2ad
lk_treasury_press_releases	2024-10-04-2024-10-04-0117c7	2024-10-04-0117c7	2024-10-04	Appointment of Citi as Dealer Manager for Sri Lanka’s Proposed Sovereign Bond Exchange	https://www.treasury.gov.lk//web/press-releases/section/2024	en	https://www.treasury.gov.lk//api/file/ca6844a6-1990-4c0f-9f71-c970e5beef47
lk_treasury_press_releases	2024-09-19-2024-09-19-333bc5	2024-09-19-333bc5	2024-09-19	SRI LANKA REACHES DEBT RESTRUCTURING AGREEMENTS IN PRINCIPLE WITH EXTERNAL CREDITORS ON APPROXIMATELY US$ 17.5 BN OF SOVEREIGN DEBT	https://www.treasury.gov.lk//web/press-releases/section/2024	en	https://www.treasury.gov.lk//api/file/16dc614c-d9a9-47ff-94d6-aab0811e62ba
lk_treasury_press_releases	2024-09-13-2024-09-13-c8aeca	2024-09-13-c8aeca	2024-09-13	Cabinet Approval for Adjustment to the Personal Income Tax Structure	https://www.treasury.gov.lk//web/press-releases/section/2024	en	https://www.treasury.gov.lk//api/file/4f7b7cea-7aea-4560-93f2-402ef4c8298f
lk_treasury_press_releases	2024-09-13-2024-09-13-5237bb	2024-09-13-5237bb	2024-09-13	Successful conclusion of the Treasury Bond auction held on 12th September 2024	https://www.treasury.gov.lk//web/press-releases/section/2024	en	https://www.treasury.gov.lk//api/file/9de6e713-ec93-4d40-8d28-e43b29baa845
lk_treasury_press_releases	2024-09-12-2024-09-12-5d0f86	2024-09-12-5d0f86	2024-09-12	Clarification on Sri Lanka's External Debt Service Payments in the Recent Past	https://www.treasury.gov.lk//web/press-releases/section/2024	en	https://www.treasury.gov.lk//api/file/6c2d7cfd-0885-4103-803f-87aaa5364223
lk_treasury_press_releases	2024-09-10-2024-09-10-3a5af2	2024-09-10-3a5af2	2024-09-10	Fiscal Consideration of the Proposed Adjustments to the Public Sector Salary Structure	https://www.treasury.gov.lk//web/press-releases/section/2024	en	https://www.treasury.gov.lk//api/file/b05ffb10-d24e-4afe-9b80-09567636f923
lk_treasury_press_releases	2024-09-05-2024-09-05-983b43	2024-09-05-983b43	2024-09-05	Clarifications on Debt Restructuring and the Debt Sustainability Analysis	https://www.treasury.gov.lk//web/press-releases/section/2024	en	https://www.treasury.gov.lk//api/file/a5ac69ab-b046-49e6-aaa1-9e45bca68567
lk_treasury_press_releases	2024-09-02-2024-09-02-a254d4	2024-09-02-a254d4	2024-09-02	Clarification on the News Articles on Allegedly Unaccounted Government Borrowings for Project Loans between 2015 and 2022	https://www.treasury.gov.lk//web/press-releases/section/2024	en	https://www.treasury.gov.lk//api/file/6af9baf9-1b8e-42c6-a541-7e613ae5746a
lk_treasury_press_releases	2023-12-20-2023-12-20-2924c2	2023-12-20-2924c2	2023-12-20	Government of Sri Lanka receives notable foreign financing support from the International Financial Institutions	https://www.treasury.gov.lk//web/press-releases/section/2023	en	https://www.treasury.gov.lk//api/file/a10c7119-ad96-4c07-b1cb-be60ae1ae6c1
lk_treasury_press_releases	2023-11-29-2023-11-29-fe49c0	2023-11-29-fe49c0	2023-11-29	MISLEADING MEDIA REPORTS REGARDING THE PROCUREMENT OF HUMAN IMUNOGLOBULIN DRUGS BY THE MINISTRY OF HEALTH	https://www.treasury.gov.lk//web/press-releases/section/2023	en	https://www.treasury.gov.lk//api/file/f5555da6-656a-45ac-881b-682b01c753b1
lk_treasury_press_releases	2023-11-29-2023-11-29-97d21b	2023-11-29-97d21b	2023-11-29	Sri Lanka Reaches Agreement With Official Creditor Committee on Debt Treatment	https://www.treasury.gov.lk//web/press-releases/section/2023	en	https://www.treasury.gov.lk//api/file/608b07e4-c60d-4916-8507-23348dfd48a8
lk_treasury_press_releases	2023-10-18-2023-10-18-a85ff2	2023-10-18-a85ff2	2023-10-18	Sri Lankan government's statement on the Ad Hoc Group of Bondholders' communique, dated October 13th 2023	https://www.treasury.gov.lk//web/press-releases/section/2023	en	https://www.treasury.gov.lk//api/file/3afe74ed-fd65-4600-80c8-977e627b7d3d
lk_treasury_press_releases	2023-10-11-2023-10-11-75059a	2023-10-11-75059a	2023-10-11	Sri Lankan government reaches a preliminary agreement with China EXIM bank on debt treatment	https://www.treasury.gov.lk//web/press-releases/section/2023	en	https://www.treasury.gov.lk//api/file/177e4689-2066-4eca-b6c6-7f992226a8f2
lk_treasury_press_releases	2023-09-14-2023-09-14-ef2f37	2023-09-14-ef2f37	2023-09-14	The Financial Intelligence Unit of Sri Lanka Releases the Sanitized Report of the Second National Risk Assessment on Money Laundering and Terrorism Financing(Sinhala)	https://www.treasury.gov.lk//web/press-releases/section/2023	en	https://www.treasury.gov.lk//api/file/bd9c2328-9893-4221-b1fb-510793cf8e6f
lk_treasury_press_releases	2023-09-14-2023-09-14-ac91fe	2023-09-14-ac91fe	2023-09-14	The Financial Intelligence Unit of Sri Lanka Releases the Sanitized Report of the Second National Risk Assessment on Money Laundering and Terrorism Financing(English)	https://www.treasury.gov.lk//web/press-releases/section/2023	en	https://www.treasury.gov.lk//api/file/9a445f87-4e10-4a61-9fb6-b6a374ddf61b
lk_treasury_press_releases	2023-09-14-2023-09-14-7bc7dc	2023-09-14-7bc7dc	2023-09-14	The Financial Intelligence Unit of Sri Lanka Releases the Sanitized Report of the Second National Risk Assessment on Money Laundering and Terrorism Financing(Tamil)	https://www.treasury.gov.lk//web/press-releases/section/2023	en	https://www.treasury.gov.lk//api/file/d2d928c9-ace5-4f6b-bc59-2cfe11c986bb
lk_treasury_press_releases	2023-06-21-2023-06-21-070c24	2023-06-21-070c24	2023-06-21	Revision for Operating Guidelines of Importation of Essential Goods under Indian Credit Facility	https://www.treasury.gov.lk//web/press-releases/section/2023	en	https://www.treasury.gov.lk//api/file/ae8693fe-40d4-4379-9564-9b96fcab67cd
lk_treasury_press_releases	2022-03-28-2022-03-28-e3534f	2022-03-28-e3534f	2022-03-28	SLIBTEC, USAID to establish Sri Lanka’s first ‘Biotechnology Innovation Park’	https://www.treasury.gov.lk//web/press-releases/section/2022	en	https://www.treasury.gov.lk//api/file/079093a5-7ceb-49d0-805f-46cbcd85a0b5
lk_treasury_press_releases	2021-12-29-2021-12-29-69ba5e	2021-12-29-69ba5e	2021-12-29	මත්පැන් බෝතල් මත යෙදීමට නියමිත ආරක්ෂිත සළකුණ පිළිබදව ලංකා ඊ නිව්ස් වෙබ් අඩවියේ පළකර ඇති ප්‍රවෘත්තිය පිළිබදවයි.	https://www.treasury.gov.lk//web/press-releases/section/2021	si	https://www.treasury.gov.lk//api/file/8530d776-e4c5-4d2e-adbb-3a7f47b306dc
lk_treasury_press_releases	2021-11-03-2021-11-03-9352a4	2021-11-03-9352a4	2021-11-03	The Government of Germany pledges to convert Euro 13 million Loan into a Grant for completing the New Maternity Hospital (Teaching) Galle	https://www.treasury.gov.lk//web/press-releases/section/2021	en	https://www.treasury.gov.lk//api/file/9fb7c5cc-3ea1-4a64-b8b9-b0d5c37fb7d3
lk_treasury_press_releases	2021-11-03-2021-11-03-011f78	2021-11-03-011f78	2021-11-03	Inclusive Connectivity and Development Project (ICDP)	https://www.treasury.gov.lk//web/press-releases/section/2021	en	https://www.treasury.gov.lk//api/file/b6b38be9-715c-47c3-a2d4-e8ff7ba20c8c
lk_treasury_press_releases	2021-10-04-2021-10-04-8c6b5a	2021-10-04-8c6b5a	2021-10-04	ඉන්දීය විදේශ ලේකම්වරයා සහ  මුදල් අමාත්‍ය බැසිල් රාජපක්ෂ මහතා අතර හමුවක්	https://www.treasury.gov.lk//web/press-releases/section/2021	si	https://www.treasury.gov.lk//api/file/b54abd6b-968b-45df-8281-5b5ba4b1f6b0
lk_treasury_press_releases	2021-09-12-2021-09-12-0b36e1	2021-09-12-0b36e1	2021-09-12	රැකියා සඳහා විදෙස් ගත වන පිරිසට බලපාන ගැටලු කඩිනමින් විසඳන්නැයි මුදල් අමාත්‍යවරයාගෙන් බලධාරීන්ට උපදෙස්..	https://www.treasury.gov.lk//web/press-releases/section/2021	si	https://www.treasury.gov.lk//api/file/969530f1-f14b-44ab-965e-4485cdbe5be5
lk_treasury_press_releases	2021-08-31-2021-08-31-8845d1	2021-08-31-8845d1	2021-08-31	RMB 2000 million Facility Agreement between Sri Lanka and China	https://www.treasury.gov.lk//web/press-releases/section/2021	en	https://www.treasury.gov.lk//api/file/0d6ca00c-5c14-45f4-a084-8099a8355df8
lk_treasury_press_releases	2021-08-19-2021-08-19-287004	2021-08-19-287004	2021-08-19	නෝවේජියානු, තුර්කි සහ ඉතාලි තානාපතිවරියන් මුදල් අමාත්‍ය බැසිල් රාජපක්ෂ මහතා හමු වෙයි.	https://www.treasury.gov.lk//web/press-releases/section/2021	si	https://www.treasury.gov.lk//api/file/8d401c56-9478-4692-8f4e-bc5713a81df0
lk_treasury_press_releases	2021-07-31-2021-07-31-6ec333	2021-07-31-6ec333	2021-07-31	ජපානය, නෙදර්ලන්තය, මැලේසියාව ඇතුළු රටවල් 06 ක තානාපතිවරු මුදල් අමාත්‍ය බැසිල් රාජපක්ෂ මහතා හමුවෙති	https://www.treasury.gov.lk//web/press-releases/section/2021	si	https://www.treasury.gov.lk//api/file/5adc48dd-6a8e-425d-9592-363cad052bdf
lk_treasury_press_releases	2021-07-30-2021-07-30-9730e6	2021-07-30-9730e6	2021-07-30	සංචාරක කර්මාන්තයට පහසුකම් දෙන්න රජය සූදානම් - මුදල් අමාතය බැසිල් රාජපක්ෂ මහතා	https://www.treasury.gov.lk//web/press-releases/section/2021	si	https://www.treasury.gov.lk//api/file/fa829639-d6e0-41e8-a95f-034fa35c7d31
lk_treasury_press_releases	2021-07-29-2021-07-29-de72a4	2021-07-29-de72a4	2021-07-29	Japan Provides Human Resources Development Scholarships  for the Sri Lankan Public Sector	https://www.treasury.gov.lk//web/press-releases/section/2021	en	https://www.treasury.gov.lk//api/file/f6042732-be7b-4d9b-971e-41e134228c9e
lk_treasury_press_releases	2021-07-19-2021-07-19-881609	2021-07-19-881609	2021-07-19	Statement by Moody's Investors Service is ill-timed, ill-judged, and hence unacceptable	https://www.treasury.gov.lk//web/press-releases/section/2021	en	https://www.treasury.gov.lk//api/file/136d3fea-9fb1-473d-8858-a2b74b004197
lk_treasury_press_releases	2021-07-10-2021-07-10-7e56ef	2021-07-10-7e56ef	2021-07-10	USD 150 Million Financial Assistance from the Asian Development Bank for Responsive COVID-19 Vaccines for Recovery (RECOVER) project	https://www.treasury.gov.lk//web/press-releases/section/2021	en	https://www.treasury.gov.lk//api/file/50d33ae1-ad0e-485b-a8e7-a7c0dcc0a3ae
lk_treasury_press_releases	2021-04-12-2021-04-12-f06c5f	2021-04-12-f06c5f	2021-04-12	USD 500 Mn Foreign Currency Term Financing Facility signed on April 12, 2021	https://www.treasury.gov.lk//web/press-releases/section/2021	en	https://www.treasury.gov.lk//api/file/3b5b7e6f-5668-4eae-bca8-aca1cc331b8d
lk_treasury_press_releases	2021-03-15-2021-03-15-120fbd	2021-03-15-120fbd	2021-03-15	බැංකු ණය නොගෙවීම හේතුවෙන් දේපළ වෙන්දේසි කිරීමට පෙර ඒ පිළිබඳ සොයා බැලීමට බලධාරියකු පත් කරන්නැයි අග්‍රාමාත්‍ය මහින්ද රාජපක්ෂ මැතිතුමාගෙන් උපදෙස්	https://www.treasury.gov.lk//web/press-releases/section/2021	si	https://www.treasury.gov.lk//api/file/493953b0-6773-4403-8470-cfcb66aebb59
lk_treasury_press_releases	2021-03-09-2021-03-09-59dd87	2021-03-09-59dd87	2021-03-09	සංවර්ධන ව්‍යාපෘති සඳහා ණය ගැනීමේ දී අදාළ ව්‍යාපෘතිය තුළින් ම ණය ගෙවීමට ඇති හැකියාව සොයා බලන්න - අග්‍රාමාත්‍යතුමාගෙන් නිලධාරීන්ට උපදෙස්	https://www.treasury.gov.lk//web/press-releases/section/2021	si	https://www.treasury.gov.lk//api/file/7a212380-197b-424f-881e-1b696b7ade10
lk_treasury_press_releases	2021-03-03-2021-03-03-4c192e	2021-03-03-4c192e	2021-03-03	කොළඹ නගරයේ රථ වාහන තදබදය අවම කිරීමට යෝධ සංවර්ධනය සැලසුමක්	https://www.treasury.gov.lk//web/press-releases/section/2021	si	https://www.treasury.gov.lk//api/file/9c9cbe7b-a300-4c39-9fcf-893166cf18b2
lk_treasury_press_releases	2021-03-02-2021-03-02-e1e267	2021-03-02-e1e267	2021-03-02	ආයෝජකයන් දිරි ගැන්වීමේ රජයේ ප්‍රතිපත්තියට සහය දෙමින් තක්සේරු වාර්තා කඩිනමින් නිකුත් කරන්නැයි අග්‍රාමාත්‍යතුමාගෙන් බලධාරීන්ට උපදෙස්	https://www.treasury.gov.lk//web/press-releases/section/2021	si	https://www.treasury.gov.lk//api/file/0d38f819-e349-4ddd-8e5f-84109fa9bc11
lk_treasury_press_releases	2021-02-09-2021-02-09-f75871	2021-02-09-f75871	2021-02-09	කොවිඩ් හේතුවෙන් ගෙවා ගත නොහැකි වූ රථ වාහන හිඟ ලීසිං වාරික ගෙවීම ඉදිරියට රැගෙන යාමට හැකි ක්‍රමවේදයක් සකසන්නැයි අග්‍රමාත්‍යතුමාගෙන් නිලධාරීන්ට උපදෙස්.	https://www.treasury.gov.lk//web/press-releases/section/2021	si	https://www.treasury.gov.lk//api/file/85cbe4cf-67b4-436e-9272-50c651cdc875
lk_treasury_press_releases	2021-02-01-2021-02-01-11a96f	2021-02-01-11a96f	2021-02-01	2019 තුන් වැනි කාර්තුවට සාපේක්ෂව විදුලි සංදේශ සහ තොරතුරු තාක්ෂණ ක්ෂේත්‍රයේ සුවිශේෂී වර්ධනයක්	https://www.treasury.gov.lk//web/press-releases/section/2021	si	https://www.treasury.gov.lk//api/file/686863a8-7476-4943-82f6-a876337f0071
lk_treasury_press_releases	2020-12-27-2020-12-27-d03ae1	2020-12-27-d03ae1	2020-12-27	කාන්තා ව්‍යවසායකයන් 25,000ක් සවිබල ගන්වමින් පාරිභෝගිකයන් සූරා කන වෙළෙඳ ජාලය වෙනුවට රජයේ තීන්දු ඒ අයුරින් ම ක්‍රියාත්මක කරන ග්‍රාමීය වෙළෙඳ ජාලයක්	https://www.treasury.gov.lk//web/press-releases/section/2020	si	https://www.treasury.gov.lk//api/file/7ed8071f-42fc-4a8e-b48d-7dfc3bddb292
lk_treasury_press_releases	2020-12-21-2020-12-21-c59a55	2020-12-21-c59a55	2020-12-21	2021 අයවැය යෝජනා ක්‍රියාත්මක කිරීම විදේශයන්හි සේවා නියුක්ත ශ්‍රී ලාංකිකයින් සඳහා දිරිදීමනා	https://www.treasury.gov.lk//web/press-releases/section/2020	si	https://www.treasury.gov.lk//api/file/6c385b26-0744-4292-ae4e-46d3f9902d38
lk_treasury_press_releases	2020-12-21-2020-12-21-b32dd3	2020-12-21-b32dd3	2020-12-21	Implementation of the Budget Proposal 2021 Incentives for Sri Lankan workers employed overseas	https://www.treasury.gov.lk//web/press-releases/section/2020	en	https://www.treasury.gov.lk//api/file/561f0bd3-c733-49e1-af44-bd9c5aa488e1
lk_treasury_press_releases	2020-12-17-2020-12-17-51eb70	2020-12-17-51eb70	2020-12-17	රාජ්‍ය හා පෞද්ගලික අංශයේ සේවකයින්, විශ්‍රාමිකයන්, සමෘද්ධිලාභීන් සහ ස්වයං රැකියාවල යෙදෙන්නන් සඳහා වන පරිපූරක උත්සව ණය පහසුකම් යෝජනා ක්‍රමය	https://www.treasury.gov.lk//web/press-releases/section/2020	si	https://www.treasury.gov.lk//api/file/b14a049f-93fe-48f5-94b6-7b49f50392ae
lk_treasury_press_releases	2020-12-17-2020-12-17-4c98f8	2020-12-17-4c98f8	2020-12-17	Supplementary Festival Credit Facility for employees in the public and private sector, Pensioners, Samurdhi Holders and Self-employees	https://www.treasury.gov.lk//web/press-releases/section/2020	en	https://www.treasury.gov.lk//api/file/839ae6a8-920d-4b37-94ba-4d72c731562f
lk_treasury_press_releases	2020-12-16-2020-12-16-86cd5c	2020-12-16-86cd5c	2020-12-16	ශ්‍රී ලංකාවේ ක්‍රියාත්මක සමාජ ආරක්ෂණ වැඩසටහන් සම්බන්ධයෙන් අමෙරිකානු රජයේ ප්‍රසාදය	https://www.treasury.gov.lk//web/press-releases/section/2020	si	https://www.treasury.gov.lk//api/file/b0c8e424-5062-475c-9160-816eca68e489
